id,name,type,entry
1,bulbasaur,grass,"BULBASAUR can be seen napping in bright sunlight. There is a seed on its back. By soaking up the sun’s rays, the seed grows progressively larger."
2,ivysaur,grass,"To support its bulb, IVYSAUR’s legs grow sturdy. If it spends more time lying in the sunlight, the bud will soon bloom into a large flower."
3,venusaur,grass,VENUSAUR’s flower is said to take on vivid colors if it gets plenty of nutrition and sunlight. The flower’s aroma soothes the emotions of people.
4,charmander,fire,"The flame that burns at the tip of its tail is an indication of its emotions. The flame wavers when CHARMANDER is happy, and blazes when it is enraged."
5,charmeleon,fire,"Without pity, its sharp claws destroy foes. If it encounters a strong enemy, it becomes agitated, and the flame on its tail flares with a bluish white color."
6,charizard,fire,"A CHARIZARD flies about in search of strong opponents. It breathes intense flames that can melt any material. However, it will never torch a weaker foe."
7,squirtle,water,"Its shell is not just for protection. Its rounded shape and the grooves on its surface minimize resistance in water, enabling SQUIRTLE to swim at high speeds."
8,wartortle,water,"Its large tail is covered with rich, thick fur that deepens in color with age. The scratches on its shell are evidence of this POKéMON’s toughness in battle."
9,blastoise,water,The waterspouts that protrude from its shell are highly accurate. Their bullets of water can precisely nail tin cans from a distance of over 160 feet.
10,caterpie,bug,Its voracious appetite compels it to devour leaves bigger than itself without hesitation. It releases a terribly strong odor from its antennae.
11,metapod,bug,Its shell is as hard as an iron slab. A METAPOD does not move very much because it is preparing its soft innards for evolution inside the shell.
12,butterfree,bug,"It has a superior ability to search for delicious honey from flowers. It can seek, extract, and carry honey from flowers blooming over six miles away."
13,weedle,bug,A WEEDLE has an extremely acute sense of smell. It distinguishes its favorite kinds of leaves from those it dislikes by sniffing with its big red proboscis (nose).
14,kakuna,bug,"It remains virtually immobile while it clings to a tree. However, on the inside, it busily prepares for evolution. This is evident from how hot its shell becomes."
15,beedrill,bug,"A BEEDRILL is extremely territorial. For safety reasons, no one should ever approach its nest. If angered, they will attack in a swarm."
16,pidgey,normal,"It has an extremely sharp sense of direction. It can unerringly return home to its nest, however far it may be removed from its familiar surroundings."
17,pidgeotto,normal,"This POKéMON flies around, patrolling its large territory. If its living space is violated, it shows no mercy in thoroughly punishing the foe with its sharp claws."
18,pidgeot,normal,"This POKéMON has gorgeous, glossy feathers. Many TRAINERS are so captivated by the beautiful feathers on its head that they choose PIDGEOT as their POKéMON."
19,rattata,normal,"A RATTATA is cautious in the extreme. Even while it is asleep, it constantly moves its ears and listens for danger. It will make its nest anywhere."
20,raticate,normal,"A RATICATE’s sturdy fangs grow steadily. To keep them ground down, it gnaws on rocks and logs. It may even chew on the walls of houses."
21,spearow,normal,"Its loud cry can be heard over half a mile away. If its high, keening cry is heard echoing all around, it is a sign that they are warning each other of danger."
22,fearow,normal,Its long neck and elongated beak are ideal for catching prey in soil or water. It deftly moves this extended and skinny beak to pluck prey.
23,ekans,poison,An EKANS curls itself up in a spiral while it rests. This position allows it to quickly respond to an enemy from any direction with a threat from its upraised head.
24,arbok,poison,"This POKéMON has a terrifically strong constricting power. It can even flatten steel oil drums. Once it wraps its body around its foe, escaping is impossible."
25,pikachu,electric,"It stores electricity in the electric sacs on its cheeks. When it releases pent-up energy in a burst, the electric power is equal to a lightning bolt."
26,raichu,electric,"If it stores too much electricity, its behavior turns aggressive. To avoid this, it occasionally discharges excess energy and calms itself down."
27,sandshrew,ground,"When it curls up in a ball, it can make any attack bounce off harmlessly. Its hide has turned tough and solid as a result of living in the desert."
28,sandslash,ground,It curls up in a ball to protect itself from enemy attacks. It also curls up to prevent heatstroke during the daytime when temperatures rise sharply.
29,nidoran-f,poison,"Its highly toxic barbs are thought to have developed as protection for this small- bodied POKéMON. When enraged, it releases a horrible toxin from its horn."
30,nidorina,poison,"When it is with its friends or family, its barbs are tucked away to prevent injury. It appears to become nervous if separated from the others."
31,nidoqueen,poison,"It is adept at sending foes flying with harsh tackles using its tough, scaly body. This POKéMON is at its strongest when it is defending its young."
32,nidoran-m,poison,The male NIDORAN has developed muscles that freely move its ears in any direction. Even the slightest sound does not escape this POKéMON’s notice.
33,nidorino,poison,"Its horn is harder than a diamond. If it senses a hostile presence, all the barbs on its back bristle up at once, and it challenges the foe with all its might."
34,nidoking,poison,"A NIDOKING’s thick tail packs enormously destructive power capable of toppling a metal transmission tower. Once it goes on a rampage, there is no stopping it."
35,clefairy,fairy,"On every night of a full moon, they come out to play. When dawn arrives, the tired CLEFAIRY go to sleep nestled up against each other in deep and quiet mountains."
36,clefable,fairy,"A CLEFABLE uses its wings to skip lightly as if it were flying. Its bouncy step lets it even walk on water. On quiet, moonlit nights, it strolls on lakes."
37,vulpix,fire,"It can freely control fire, making fiery orbs fly like will-o’-the-wisps. Just before evolution, its six tails grow hot as if on fire."
38,ninetales,fire,It has long been said that each of the nine tails embody an enchanted power. A long-lived NINETALES will have fur that shines like gold.
39,jigglypuff,normal,Nothing can avoid falling asleep hearing a JIGGLYPUFF’s song. The sound waves of its singing voice match the brain waves of someone in a deep sleep.
40,wigglytuff,normal,Its fur is the ultimate in luxuriousness. Sleeping alongside a WIGGLYTUFF is simply divine. Its body expands seemingly without end when it inhales.
41,zubat,poison,"While living in pitch-black caverns, their eyes gradually grew shut and deprived them of vision. They use ultrasonic waves to detect obstacles."
42,golbat,poison,Its fangs easily puncture even thick animal hide. It loves to feast on the blood of people and POKéMON. It flits about in darkness and strikes from behind.
43,oddish,grass,"This POKéMON grows by absorbing moonlight. During the daytime, it buries itself in the ground, leaving only its leaves exposed to avoid detection by its enemies."
44,gloom,grass,"A horribly noxious honey drools from its mouth. One whiff of the honey can result in memory loss. Some fans are said to enjoy this overwhelming stink, however."
45,vileplume,grass,"In seasons when it produces more pollen, the air around a VILEPLUME turns yellow with the powder as it walks. The pollen is highly toxic and causes paralysis."
46,paras,bug,A PARAS has parasitic tochukaso mushrooms growing on its back. They grow by drawing nutrients from the host. They are valued as a medicine for long life.
47,parasect,bug,"PARASECT are known to infest the roots of large trees en masse and drain nutrients. When an infested tree dies, they move onto another tree all at once."
48,venonat,bug,"Its coat of thin, stiff hair that covers its entire body is said to have evolved for protection. Its large eyes never fail to spot even miniscule prey."
49,venomoth,bug,"VENOMOTH are nocturnal--they only are active at night. Their favorite prey are insects that gather around streetlights, attracted by the light in the darkness."
50,diglett,ground,"DIGLETT are raised in most farms. The reason is simple--wherever they burrow, the soil is left perfectly tilled for growing delicious crops."
51,dugtrio,ground,"Because the triplets originally split from one body, they think exactly alike. They work cooperatively to burrow endlessly through the ground."
52,meowth,normal,"MEOWTH withdraw their sharp claws into their paws to silently sneak about. For some reason, this POKéMON loves shiny coins that glitter with light."
53,persian,normal,A PERSIAN’s six bold whiskers sense air movements to determine what is in its vicinity. It becomes docile if grabbed by the whiskers.
54,psyduck,water,"When its headache intensifies, it starts using strange powers. However, it has no recollection of its powers, so it always looks befuddled and bewildered."
55,golduck,water,A GOLDUCK is an adept swimmer. It sometimes joins competitive swimmers in training. It uses psychic powers when its forehead shimmers with light.
56,mankey,fighting,"When it starts shaking and its nasal breathing turns rough, it’s a sure sign of anger. However, since this happens instantly, there is no time to flee."
57,primeape,fighting,"When it becomes furious, its blood circulation becomes more robust, and its muscles are made stronger. But it also becomes much less intelligent."
58,growlithe,fire,"Its superb sense of smell ensures that this POKéMON won’t forget any scent, no matter what. It uses its sense of smell to detect the emotions of others."
59,arcanine,fire,"This fleet-footed POKéMON is said to run over 6,200 miles in a single day and night. The fire that blazes wildly within its body is its source of power."
60,poliwag,water,"It is possible to see this POKéMON’s spiral innards right through its thin skin. However, the skin is also very flexible. Even sharp fangs bounce right off it."
61,poliwhirl,water,"Its body surface is always wet and slick with an oily fluid. Because of this greasy covering, it can easily slip and slide out of the clutches of any enemy in battle."
62,poliwrath,water,"Its highly developed muscles never grow fatigued, however much it exercises. This POKéMON can swim back and forth across the Pacific Ocean without effort."
63,abra,psychic,A POKéMON that sleeps 18 hours a day. Observation revealed that it uses TELEPORT to change its location once every hour.
64,kadabra,psychic,It is rumored that a boy with psychic abilities suddenly transformed into KADABRA while he was assisting research into extrasensory powers.
65,alakazam,psychic,"While it has strong psychic abilities and high intelligence, an ALAKAZAM’s muscles are very weak. It uses psychic power to move its body."
66,machop,fighting,It continually undertakes strenuous training to master all forms of martial arts. Its strength lets it easily hoist a sumo wrestler onto its shoulders.
67,machoke,fighting,"A belt is worn by a MACHOKE to keep its overwhelming power under control. Because it is so dangerous, no one has ever removed the belt."
68,machamp,fighting,It is impossible to defend against punches and chops doled out by its four arms. Its fighting spirit flares up when it faces a tough opponent.
69,bellsprout,grass,"A BELLSPROUT’s thin and flexible body lets it bend and sway to avoid any attack, however strong it may be. From its mouth, it leaks a fluid that melts even iron."
70,weepinbell,grass,"At night, a WEEPINBELL hangs on to a tree branch with its hooked rear and sleeps. If it moves around in its sleep, it may wake up to find itself on the ground."
71,victreebel,grass,"The long vine extending from its head is waved about as if it were a living thing to attract prey. When an unsuspecting victim approaches, it is swallowed whole."
72,tentacool,water,"Its body is almost entirely composed of water. It ensnares its foe with its two long tentacles, then stabs with the poison stingers at their tips."
73,tentacruel,water,It lives in complex rock formations on the ocean floor and traps prey using its 80 tentacles. Its red orbs glow when it grows excited or agitated.
74,geodude,rock,"It climbs mountain paths using only the power of its arms. Because they look just like boulders lining paths, hikers may step on them without noticing."
75,graveler,rock,"They descend from mountains by tumbling down steep slopes. They are so brutal, they smash aside obstructing trees and massive boulders with thunderous tackles."
76,golem,rock,"It is said to live in volcanic craters on mountain peaks. Once a year, it sheds its hide and grows larger. The shed hide crumbles and returns to the soil."
77,ponyta,fire,A PONYTA is very weak at birth. It can barely stand up. Its legs become stronger as it stumbles and falls while trying to keep up with its parent.
78,rapidash,fire,"It usually canters casually in the fields and plains. But once a RAPIDASH turns serious, its fiery manes flare and blaze as it gallops its way up to 150 mph."
79,slowpoke,water,It catches prey by dipping its tail in water at the side of a river. But it often forgets what it is doing and spends entire days just loafing at water’s edge.
80,slowbro,water,"Its tail has a SHELLDER firmly attached with a bite. As a result, the tail can’t be used for fishing anymore. This forces it to reluctantly swim and catch prey."
81,magnemite,electric,The units at its sides are extremely powerful magnets. They generate enough magnetism to draw in iron objects from over 300 feet away.
82,magneton,electric,"It is actually three MAGNEMITE linked by magnetism. It generates powerful radio waves that raise temperatures by 3.6 degrees F within a 3,300-foot radius."
83,farfetchd,normal,"It is always seen with a stick from a plant. Apparently, there are good sticks and bad sticks. This POKéMON occasionally fights with others over choice sticks."
84,doduo,normal,"Even while eating or sleeping, one of the heads remains always vigilant for any sign of danger. When threatened, it flees at over 60 miles per hour."
85,dodrio,normal,A peculiar POKéMON species with three heads. It vigorously races across grassy plains even in arid seasons with little rainfall.
86,seel,water,"SEEL hunt for prey in frigid, ice-covered seas. When it needs to breathe, it punches a hole through the ice with the sharply protruding section of its head."
87,dewgong,water,It loves to snooze on bitterly cold ice. The sight of this POKéMON sleeping on a glacier was mistakenly thought to be a mermaid by a mariner long ago.
88,grimer,poison,"Born from polluted sludge in the sea, GRIMER’s favorite food is anything filthy. They feed on wastewater pumped out from factories."
89,muk,poison,"It prefers warm and humid habitats. In the summertime, the toxic substances in its body intensify, making MUK reek like putrid kitchen garbage."
90,shellder,water,"At night, it burrows a hole in the seafloor with its broad tongue to make a place to sleep. While asleep, it closes its shell, but leaves its tongue hanging out."
91,cloyster,water,"It swims in the sea by swallowing water, then jetting it out toward the rear. The CLOYSTER shoots spikes from its shell using the same system."
92,gastly,ghost,"When exposed to a strong wind, a GASTLY’s gaseous body quickly dwindles away. They cluster under the eaves of houses to escape the ravages of wind."
93,haunter,ghost,"If a HAUNTER beckons you while it is floating in darkness, don’t approach it. This POKéMON will try to lick you with its tongue and steal your life away."
94,gengar,ghost,"Deep in the night, your shadow cast by a streetlight may suddenly overtake you. It is actually a GENGAR running past you, pretending to be your shadow."
95,onix,rock,"There is a magnet in its brain that prevents an ONIX from losing direction while tunneling. As it grows older, its body becomes steadily rounder and smoother."
96,drowzee,psychic,"If your nose becomes itchy while you are sleeping, it’s a sure sign that a DROWZEE is standing above your pillow and trying to eat your dream through your nostrils."
97,hypno,psychic,"The arcing movement and glitter of the pendulum in a HYPNO’s hand lull the foe into deep hypnosis. While searching for prey, it polishes the pendulum."
98,krabby,water,"KRABBY live in holes dug into beaches. On sandy shores with little in the way of food, they can be seen squabbling with each other over territory."
99,kingler,water,"It waves its huge, oversized claw in the air to communicate with others. But since the claw is so heavy, this POKéMON quickly tires."
100,voltorb,electric,"It bears an uncanny and unexplained resemblance to a POKé BALL. Because it explodes at the slightest shock, even veteran TRAINERS treat it with caution."
101,electrode,electric,"They appear in great numbers at electric power plants. Because they feed on electricity, they cause massive and chaotic blackouts in nearby cities."
102,exeggcute,grass,"It consists of six eggs that care for each other. The eggs attract each other and spin around. When cracks increasingly appear, it is close to evolution."
103,exeggutor,grass,"Originally from the tropics, EXEGGUTOR’s heads grow larger from exposure to strong sunlight. It is said that when the heads fall, they group to form an EXEGGCUTE."
104,cubone,ground,"It pines for the mother it will never see again. Seeing a likeness of its mother in the full moon, it cries. The stains on the skull it wears are from its tears."
105,marowak,ground,A MAROWAK is the evolved form of a CUBONE that has grown tough by overcoming the grief of losing its mother. Its tempered and hardened spirit is not easily broken.
106,hitmonlee,fighting,"Its legs freely stretch and contract. Using these springlike limbs, it bowls over foes with devastating kicks. After battle, it rubs down its tired legs."
107,hitmonchan,fighting,A HITMONCHAN is said to possess the spirit of a boxer who aimed to become the world champion. Having an indomitable spirit means that it will never give up.
108,lickitung,normal,"Whenever it sees something unfamiliar, it always licks the object because it memorizes things by texture and taste. It is somewhat put off by sour things."
109,koffing,poison,"Getting up close to a KOFFING will give you a chance to observe, through its thin skin, the toxic gases swirling inside. It blows up at the slightest stimulation."
110,weezing,poison,"By diluting its toxic gases with a special process, the highest grade of perfume can be extracted. To WEEZING, gases emanating from garbage are the ultimate feast."
111,rhyhorn,ground,"Once it starts running, it doesn’t stop. Its tiny brain makes it so stupid that it can’t remember why it started running in the first place."
112,rhydon,ground,"Its horn, which rotates like a drill, destroys tall buildings with one strike. It stands on its hind legs, and its brain is well developed."
113,chansey,normal,"CHANSEY lay nutritionally excellent eggs every day. The eggs are so delicious, they are eagerly devoured by even those people who have lost their appetite."
114,tangela,grass,"Its vines snap off easily and painlessly if they are grabbed, allowing it to make a quick getaway. The lost vines are replaced by new growth the very next day."
115,kangaskhan,normal,"If you come across a young KANGASKHAN playing by itself, never try to catch it. The baby’s parent is sure to be in the area, and it will become violently enraged."
116,horsea,water,"By cleverly flicking the fins on its back side to side, it moves in any direction while facing forward. It spits ink to escape if it senses danger."
117,seadra,water,The poisonous barbs all over its body are highly valued as ingredients for making traditional herbal medicine. It shows no mercy to anything approaching its nest.
118,goldeen,water,"In the springtime, schools of GOLDEEN can be seen swimming up falls and rivers. It metes out staggering damage with its single horn."
119,seaking,water,It punches holes in boulders on stream­ beds. This is a clever innovation that prevents its eggs from being attacked or washed away by the current.
120,staryu,water,It gathers with others in the night and makes its red core glow on and off with the twinkling stars. It can regenerate limbs if they are severed from its body.
121,starmie,water,People in ancient times imagined that STARMIE were transformed from the reflections of stars that twinkled on gentle waves at night.
122,mr-mime,psychic,"A MR. MIME is a master of pantomime. It can convince others that something unseeable actually exists. Once believed, the imaginary object does become real."
123,scyther,bug,Its blindingly fast speed adds to the sharpness of its twin forearm scythes. The scythes can slice through thick logs in one wicked stroke.
124,jynx,ice,"A JYNX sashays rhythmically as if it were dancing. Its motions are so bouncingly alluring, people seeing it are compelled to shake their hips without noticing."
125,electabuzz,electric,"When a storm approaches, it competes with others to scale heights that are likely to be stricken by lightning. Some towns use ELECTABUZZ in place of lightning rods."
126,magmar,fire,"In battle, it blows out intense flames from all over its body to intimidate its foe. These fiery bursts create heat waves that ignite grass and trees in the area."
127,pinsir,bug,"Their pincers are strong enough to shatter thick logs. Because they dislike cold, PINSIR burrow and sleep under the ground on chilly nights."
128,tauros,normal,"It is not satisfied unless it is rampaging at all times. If there is no opponent for TAUROS to battle, it will charge at thick trees and knock them down to calm itself."
129,magikarp,water,"Its swimming muscles are weak, so it is easily washed away by currents. In places where water pools, you can see many MAGIKARP deposited there by the flow."
130,gyarados,water,"It is an extremely vicious and violent POKéMON. When humans begin to fight, it will appear and burn everything to the ground with intensely hot flames."
131,lapras,water,"People have driven LAPRAS almost to the point of extinction. In the evenings, it is said to sing plaintively as it seeks what few others of its kind still remain."
132,ditto,normal,"A DITTO rearranges its cell structure to transform itself. However, if it tries to change based on its memory, it will get details wrong."
133,eevee,normal,An EEVEE has an unstable genetic makeup that suddenly mutates due to its environment. Radiation from various STONES causes this POKéMON to evolve.
134,vaporeon,water,VAPOREON underwent a spontaneous mutation and grew fins and gills that allow them to live underwater. They have the ability to freely control water.
135,jolteon,electric,Its cells generate weak power that is amplified by its fur’s static electricity to drop thunderbolts. The bristling fur is made of electrically charged needles.
136,flareon,fire,"FLAREON’s fluffy fur releases heat into the air so that its body does not get excessively hot. Its body temperature can rise to a maximum of 1,650 degrees F."
137,porygon,normal,It is capable of reverting itself entirely back to program data in order to enter cyberspace. A PORYGON is copy- protected so it cannot be duplicated.
138,omanyte,rock,"One of the ancient and long-since-extinct POKéMON that have been regenerated from fossils by humans. If attacked, it withdraws into its hard shell."
139,omastar,rock,"An OMASTAR uses its tentacles to capture its prey. It is believed to have become extinct because its shell grew too large, making its movements slow and ponderous."
140,kabuto,rock,"It is a POKéMON that has been regenerated from a fossil. However, in rare cases, living examples have been discovered. KABUTO have not changed for 300 million years."
141,kabutops,rock,KABUTOPS once swam underwater to hunt for prey. It was apparently evolving from being a water dweller to living on land as evident from changes in its gills and legs.
142,aerodactyl,rock,AERODACTYL is a POKéMON from the age of dinosaurs. It was regenerated from DNA extracted from amber. It is imagined to have been the king of the skies.
143,snorlax,normal,SNORLAX’s typical day consists of nothing more than eating and sleeping. It is such a docile POKéMON that there are children who use its big belly as a place to play.
144,articuno,ice,"ARTICUNO is a legendary bird POKéMON that can control ice. The flapping of its wings chills the air. As a result, it is said that when this POKéMON flies, snow will fall."
145,zapdos,electric,ZAPDOS is a legendary bird POKéMON that has the ability to control electricity. It usually lives in thunderclouds. It gains power if it is stricken by lightning bolts.
146,moltres,fire,"MOLTRES is a legendary bird POKéMON that can control fire. If injured, it is said to dip its body in the molten magma of a volcano to burn and heal itself."
147,dratini,dragon,A DRATINI continually molts and sloughs off its old skin. It does so because the life energy within its body steadily builds to reach uncontrollable levels.
148,dragonair,dragon,A DRAGONAIR stores an enormous amount of energy inside its body. It is said to alter the weather around it by loosing energy from the crystals on its neck and tail.
149,dragonite,dragon,It can circle the globe in just 16 hours. It is a kindhearted POKéMON that leads lost and foundering ships in a storm to the safety of land.
