id,name,type,entry
150,mewtwo,psychic,"A POKéMON that was created by genetic manipulation. However, even though the scientific power of humans made its body, they failed to give it a warm heart."
151,mew,psychic,"A MEW is said to possess the genes of all POKéMON. It is capable of making itself invisible at will, so it entirely avoids notice even if it approaches people."
152,chikorita,grass,"It waves its leaf around to keep foes at bay. However, a sweet fragrance also wafts from the leaf, creating a friendly atmosphere that becalms the battlers."
153,bayleef,grass,A BAYLEEF’s neck is ringed by curled-up leaves. Inside each leaf is a small tree shoot. The fragrance of this shoot makes people peppy.
154,meganium,grass,"The fragrance of a MEGANIUM’s flower soothes and calms emotions. In battle, it gives off more of its becalming scent to blunt the foe’s fighting spirit."
155,cyndaquil,fire,"It flares flames from its back to protect itself. The fire burns vigorously if the POKéMON is angry. When it is tired, it sputters with incomplete combustion."
156,quilava,fire,It intimidates foes with intense gusts of flames and superheated air. Its quick nimbleness lets it dodge attacks even while scorching an enemy.
157,typhlosion,fire,It can hide behind a shimmering heat haze that it creates using its intense flames. TYPHLOSION create blazing explosive blasts that burn everything to cinders.
158,totodile,water,"Despite its small body, TOTODILE’s jaws are very powerful. While it may think it is just playfully nipping, its bite has enough strength to cause serious injury."
159,croconaw,water,"Once its jaws clamp down on its foe, it will absolutely not let go. Because the tips of its fangs are forked back like fishhooks, they become irremovably embedded."
160,feraligatr,water,"It opens its huge mouth to intimidate enemies. In battle, it runs using its thick and powerful hind legs to charge the foe with incredible speed."
161,sentret,normal,"They take turns standing guard when it is time to sleep. The sentry awakens the others if it senses danger. If one becomes separated, it turns sleepless with fear."
162,furret,normal,"A FURRET has a very slim build. When under attack, it can squirm through narrow spaces and get away. In spite of its short limbs, it is very nimble and fleet."
163,hoothoot,normal,"It has an internal organ that senses the earth’s rotation. Using this special organ, a HOOTHOOT begins hooting at precisely the same time every day."
164,noctowl,normal,"It unfailingly catches prey in darkness. NOCTOWL owe their success to superior vision that allows them to see in minimal light, and to their supple and silent wings."
165,ledyba,bug,LEDYBA communicate using a fluid that they secrete from where the legs join the body. They are said to convey feelings to others by altering the fluid’s scent.
166,ledian,bug,"It is said that in lands with clean air, where the stars fill the sky, there live many LEDIAN. For good reason, they use the light of the stars as energy."
167,spinarak,bug,The web it spins can be considered its second nervous system. It is said that a SPINARAK determines its prey by the tiny vibrations it feels through the web.
168,ariados,bug,Its feet are tipped with tiny hooked claws that enable it to scuttle on ceilings and vertical walls. It constricts its foe with thin and strong silk webbing.
169,crobat,poison,"Over the course of evolution, its hind legs turned into wings. By alternately resting its front and rear wings, it can fly all day without having to stop."
170,chinchou,water,"When it senses danger, it discharges positive and negative electricity from its two antennae. It lives in depths beyond sunlight’s reach."
171,lanturn,water,The light-emitting orbs on its back are very bright. They are formed from a part of its dorsal fin. This POKéMON illuminates the inky darkness of deep seas.
172,pichu,electric,"It is still inept at retaining electricity. When it is startled, it discharges power accidentally. It gets better at holding power as it grows older."
173,cleffa,fairy,"On nights with many shooting stars, CLEFFA can be seen dancing in a ring. They dance until daybreak, when they quench their thirst with the morning dew."
174,igglybuff,normal,"Its soft and pliable body is very bouncy. When it sings continuously with all its might, its body steadily turns a deepening pink color."
175,togepi,fairy,"As its energy, it uses the feelings of compassion and pleasure exuded by people and POKéMON. It stores up happy feelings in its shell, then shares them out."
176,togetic,fairy,"It is said to be a POKéMON that brings good fortune. When it spots someone who is pure of heart, a TOGETIC appears and shares its happiness with that person."
177,natu,psychic,It runs up short trees that grow on the savanna to peck at new shoots. A NATU’s eyes look as if they are always observing something.
178,xatu,psychic,It has the enigmatic power of foreseeing the future. Some people in different lands have long believed that XATU are emissaries from another world.
179,mareep,electric,"Its fluffy wool rubs together and builds a static charge. The more energy is charged, the more brightly the lightbulb at the tip of its tail glows."
180,flaaffy,electric,"Its fleece quality changes to generate strong static electricity with a small amount of wool. The bare, slick parts of its hide are shielded against electricity."
181,ampharos,electric,It gives off so much light that it can be seen even from space. People in the old days used its light to send signals back and forth with others far away.
182,bellossom,grass,"Its flower petals deepen in color through exposure to sunlight. When cloudy weather persists, it does a dance that is thought to be a ritual for summoning the sun."
183,marill,water,"Its body is covered with water-repellent fur. Because of the fur, it can swim through water at high speed without being slowed by the water’s resistance."
184,azumarill,water,It lives in water virtually all day long. Its body color and pattern act as camouflage that makes it tough for enemies to spot in water.
185,sudowoodo,rock,"It mimics a tree to avoid being attacked by enemies. But since its forelegs remain green throughout the year, it is easily identified as a fake in the winter."
186,politoed,water,"The curled hair on its head proves its status as a king. It is said that the longer and curlier the hair, the more respect it earns from its peers."
187,hoppip,grass,"This POKéMON drifts and floats with the wind. If it senses the approach of strong winds, a HOPPIP links leaves with others to prepare against being blown away."
188,skiploom,grass,"It blossoms when the temperature rises above 64 degrees F. Because its flower’s blooming changes with the temperature, it is sometimes used as a thermometer."
189,jumpluff,grass,JUMPLUFF ride warm southern winds to cross the sea and fly to foreign lands. This POKéMON lands when it encounters cold air while it is floating.
190,aipom,normal,"Its tail ends with a dexterous, handlike appendage. However, because it uses the tail so much, AIPOM’s real hands have become rather clumsy."
191,sunkern,grass,"SUNKERN try to minimize movement to conserve the nutrients they have stored in their bodies for evolution. They will not eat, subsisting only on morning dew."
192,sunflora,grass,SUNFLORA convert solar energy into nutrition. They are highly active in the warm daytime but suddenly stop moving as soon as the sun sets.
193,yanma,bug,It can see 360 degrees without moving its eyes. It is a great flier capable of making sudden stops and turning midair to quickly chase down targeted prey.
194,wooper,water,"WOOPER usually live in water but come out onto land seeking food occasionally. On land, they coat their bodies with a gooey, toxic film."
195,quagsire,water,"A QUAGSIRE hunts by leaving its mouth wide open in water and waiting for its prey to blunder in. Because it doesn’t move, it does not get very hungry."
196,espeon,psychic,An ESPEON is extremely loyal to any TRAINER it considers to be worthy. It is said to have developed precognitive powers to protect its TRAINER from harm.
197,umbreon,dark,UMBREON evolved from exposure to the moon’s energy pulses. It lurks in darkness and waits for its foes to move. The rings on its body glow when it leaps to attack.
198,murkrow,dark,MURKROW were feared as the alleged bearers of ill fortune. It shows strong interest in anything that sparkles. It will even try to steal rings from women.
199,slowking,water,"It undertakes research every day to solve the mysteries of the world. However, it apparently forgets everything if the SHELLDER on its head comes off."
200,misdreavus,ghost,"A MISDREAVUS frightens people with a creepy, sobbing cry. It apparently uses its red spheres to absorb the fear of foes as its nutrition."
201,unown,psychic,"This POKéMON is shaped like ancient text characters. Although research is ongoing, it is a mystery as to which came first, the ancient writings or the various UNOWN."
202,wobbuffet,psychic,"Usually docile, a WOBBUFFET strikes back ferociously if its black tail is attacked. It makes its lair in caves where it waits for nightfall."
203,girafarig,normal,"A GIRAFARIG is an herbivore--it eats grass and tree shoots. While it is eating, its tail makes chewing and swallowing motions as if it were also eating."
204,pineco,bug,"A PINECO hangs from a tree branch and waits for prey. While eating, if it is disturbed by someone shaking its tree, it falls on the ground and suddenly explodes."
205,forretress,bug,"It keeps itself inside its steel shell. The shell is opened when it is catching prey, but it is so quick that the shell’s inside cannot be seen."
206,dunsparce,normal,Its drill-tipped tail is used to burrow into the ground backwards. This POKéMON is known to make its nest in complex shapes deep under the ground.
207,gligar,ground,"It glides without making a single sound. It grasps the face of its foe using its hind and large front claws, then stabs with its poison barb."
208,steelix,steel,"STEELIX live even further underground than ONIX. This POKéMON is known to dig toward the earth’s core, reaching a depth of over six-tenths of a mile underground."
209,snubbull,fairy,"By baring its fangs and making a scary face, it sends smaller POKéMON scurrying in terror. The SNUBBULL does seem a little sad at making its foes flee."
210,granbull,fairy,"It has a particularly well-developed lower jaw. The huge fangs are heavy, causing it to tilt its head. Unless it is startled, it will not try to bite."
211,qwilfish,water,A QWILFISH uses the pressure of water it swallows to shoot toxic quills all at once from all over its body. It finds swimming to be somewhat challenging.
212,scizor,bug,A SCIZOR has a body with the hardness of steel. It is not easily fazed by ordinary sorts of attacks. It flaps its wings to regulate its body temperature.
213,shuckle,bug,"A SHUCKLE hides under rocks, keeping its body concealed inside its shell while eating stored berries. The berries mix with its body fluids to become a juice."
214,heracross,bug,"They gather in forests seeking the sweet sap of trees. It is completely clad in a steel-hard shell. It is proud of its horn, which it uses to fling foes."
215,sneasel,dark,A SNEASEL scales trees by punching its hooked claws into the bark. It seeks out unguarded nests and steals eggs for food while the parents are away.
216,teddiursa,normal,It licks its palms that are sweetened by being soaked in honey. A TEDDIURSA makes its own honey by blending fruits and pollen collected by BEEDRILL.
217,ursaring,normal,"In forests, it is said that there are many streams and towering trees where an URSARING gathers food. It walks through its forest collecting food every day."
218,slugma,fire,"It is a species of POKéMON that lives in volcanic areas. If its body cools, its skin hardens and immobilizes it. To avoid that, it sleeps near magma."
219,magcargo,fire,The shell on its back is made of hardened magma. Tens of thousands of years spent living in volcanic craters have turned MAGCARGO’s bodies into magma.
220,swinub,ice,It roots for food by rubbing its snout against the ground. Its favorite food is a mushroom that grows under dried grass. It occasionally roots out hot springs.
221,piloswine,ice,A PILOSWINE is covered by a thick coat of long hair for enduring freezing cold. It uses its tusks to dig up food that has been buried under ice.
222,corsola,water,"CORSOLA live in warm southern seas. If the sea becomes polluted, the beautiful coral stalks become discolored and crumble away in tatters."
223,remoraid,water,"A REMORAID uses its abdominal muscles to forcefully expel swallowed water, then shoot down flying prey. When evolution approaches, it travels down rivers."
224,octillery,water,"It ensnares its foe with its suction- cupped tentacles before delivering the finishing blow. If the foe turns out to be too strong, it spews ink to escape."
225,delibird,ice,It carries food bundled up in its tail. There was a famous explorer who managed to scale Mt. Everest thanks to a DELIBIRD sharing its food.
226,mantine,water,"On sunny days, schools of MANTINE can be seen elegantly leaping over the waves. It is not bothered by the REMORAID that hitches rides."
227,skarmory,steel,A POKéMON that has a body and wings of steel. People in the past used feathers fallen from SKARMORY to make swords and knives.
228,houndour,dark,HOUNDOUR communicate with each other using a variety of cries to corner their prey. This POKéMON’s remarkable teamwork is simply unparalleled.
229,houndoom,dark,"In a HOUNDOOM pack, the one with its horns raked sharply back serves a leadership role. They choose their leader by fighting among themselves."
230,kingdra,water,"It sleeps quietly, deep on the seafloor. When it comes up to the surface, it creates a huge whirlpool that can swallow even ships."
231,phanpy,ground,"PHANPY’s big ears serve as broad fans. When it becomes hot, it flaps the ears busily to cool down. Even the young are very strong."
232,donphan,ground,A DONPHAN is so strong it can easily haul a dump truck. Its hide has toughened to a rock-hard state. An ordinary sort of attack won’t even leave a scratch.
233,porygon2,normal,It was created by humans using the power of science. It has been given artificial intelligence that enables it to learn new gestures and emotions on its own.
234,stantler,normal,"STANTLER’s magnificent antlers were once traded at high prices as works of art. As a result, this POKéMON was hunted close to extinction."
235,smeargle,normal,"A SMEARGLE marks its territory using a fluid that leaks out from the tip of its tail. About 5,000 different marks left by this POKéMON have been found."
236,tyrogue,fighting,"TYROGUE become stressed out if they do not get to train every day. When raising this POKéMON, the TRAINER must establish a regular training schedule."
237,hitmontop,fighting,Its technique of kicking while spinning is a remarkable mix of both offense and defense. HITMONTOP travel faster spinning than they do walking.
238,smoochum,ice,"It actively runs about, but also falls often. Whenever it falls, it will check its reflection on a lake’s surface to make sure its face hasn’t become dirty."
239,elekid,electric,"If it touches metal and discharges the electricity it has stored in its body, an ELEKID begins swinging its arms in circles to recharge itself."
240,magby,fire,"If a MAGBY is spouting yellow flames from its mouth, it is in good health. When it is fatigued, black smoke will be mixed in with the flames."
241,miltank,normal,It gives over five gallons of milk daily. Its sweet milk is enjoyed by children and grown-ups alike. People who can’t drink milk turn it into yogurt and eat it instead.
242,blissey,normal,"If it senses sadness with its fluffy fur, a BLISSEY will rush over to the sad person, however far away, to share an egg of happiness that brings a smile to any face."
243,raikou,electric,RAIKOU embodies the speed of lightning. Its roars send shock waves shuddering through the air and ground as if lightning bolts were crashing down.
244,entei,fire,ENTEI embodies the passion of magma. It is thought to have been born in the eruption of a volcano. It blasts fire that consumes all that it touches.
245,suicune,water,SUICUNE embodies the compassion of a pure spring of water. It runs across the land with gliding elegance. It has the power to purify dirty water.
246,larvitar,rock,A LARVITAR is born deep under the ground. It must eat its way through the soil above and reach the surface for it to see its parents’ faces.
247,pupitar,rock,A PUPITAR creates a gas inside its body that it ejects under compression to propel itself like a jet. Its body can withstand a collision with solid steel.
248,tyranitar,rock,"A TYRANITAR is so overwhelmingly powerful, it can bring down a whole mountain to make its nest. It roams in mountains seeking new opponents to fight."
249,lugia,psychic,"LUGIA is so powerful even a light fluttering of its wings can blow apart houses. As a result, it chooses to live out of sight deep under the sea."
250,ho-oh,fire,Its feathers--which glow in seven colors depending on the angle at which they are struck by light--are thought to bring joy. It is said to live at the foot of a rainbow.
251,celebi,psychic,"This POKéMON came from the future by crossing over time. It is thought that so long as CELEBI appears, a bright and shining future awaits us."
252,treecko,grass,It makes its nest in a giant tree in the forest. It ferociously guards against anything nearing its territory. It is said to be the protector of the forest’s trees.
253,grovyle,grass,Leaves grow out of this POKéMON’s body. They help obscure a GROVYLE from the eyes of its enemies while it is in a thickly overgrown forest.
254,sceptile,grass,"In the jungle, its power is without equal. This POKéMON carefully grows trees and plants. It regulates its body temperature by basking in sunlight."
255,torchic,fire,"If attacked, it strikes back by spitting balls of fire it forms in its stomach. A TORCHIC dislikes darkness because it can’t see its surroundings."
256,combusken,fire,It lashes out with 10 kicks per second. Its strong fighting instinct compels it to keep up its offensive until the opponent gives up.
257,blaziken,fire,"It learns martial arts that use punches and kicks. Every several years, its old feathers burn off, and new, supple feathers grow back in their place."
258,mudkip,water,"On land, it can powerfully lift large boulders by planting its four feet and heaving. It sleeps by burying itself in soil at the water’s edge."
259,marshtomp,water,"Its toughened hind legs enable it to stand upright. Because it weakens if its skin dries out, it replenishes fluids by playing in mud."
260,swampert,water,"If it senses the approach of a storm and a tidal wave, it protects its seaside nest by piling up boulders. It swims as fast as a jet ski."
261,poochyena,dark,"It savagely threatens foes with bared fangs. It chases after fleeing targets tenaciously. It turns tail and runs, however, if the foe strikes back."
262,mightyena,dark,"In the wild, MIGHTYENA live in a pack. They never defy their leader’s orders. They defeat foes with perfectly coordinated teamwork."
263,zigzagoon,normal,"Rubbing its nose against the ground, it always wanders about back and forth in search of something. It is distinguished by the zigzag footprints it leaves."
264,linoone,normal,"It is exceedingly fast if it only has to run in a straight line. When it spots pond- dwelling prey underwater, it quickly leaps in and catches it with its sharp claws."
265,wurmple,bug,"It sticks to tree branches and eats leaves. The thread it spits from its mouth, which becomes gooey when it touches air, slows the movement of its foes."
266,silcoon,bug,It prepares for evolution using the energy it stored while it was a WURMPLE. It keeps watch over the surroundings with its two eyes.
267,beautifly,bug,Its colorfully patterned wings are its most prominent feature. It flies through flower-covered fields collecting pollen. It attacks ferociously when angered.
268,cascoon,bug,"To avoid detection by its enemies, it hides motionlessly beneath large leaves and in the gaps of branches. It also attaches dead leaves to its body for camouflage."
269,dustox,bug,It is a nocturnal POKéMON that flies from fields and mountains to the attraction of streetlights at night. It looses highly toxic powder from its wings.
270,lotad,water,This POKéMON lives in ponds with clean water. It is known to ferry small POKéMON across ponds by carrying them on the broad leaf on its head.
271,lombre,water,"In the evening, it takes great delight in popping out of rivers and startling people. It feeds on aquatic moss that grows on rocks in the riverbed."
272,ludicolo,water,"When it hears festive music, all the cells in its body become stimulated, and it begins moving in rhythm. It does not quail even when it faces a tough opponent."
273,seedot,grass,"It hangs off branches and absorbs nutrients. When it finishes eating, its body becomes so heavy that it drops to the ground with a thump."
274,nuzleaf,grass,A forest-dwelling POKéMON that is skilled at climbing trees. Its long and pointed nose is its weak point. It loses power if the nose is gripped.
275,shiftry,grass,"It is said to arrive on chilly, wintry winds. Feared from long ago as the guardian of forests, this POKéMON lives in a deep forest where people do not venture."
276,taillow,normal,"Although it is small, it is very courageous. It will take on a larger SKARMORY on an equal footing. However, its will weakens if it becomes hungry."
277,swellow,normal,A SWELLOW dives upon prey from far above. It never misses its targets. It takes to the skies in search of lands with a warm climate.
278,wingull,water,"It makes its nest on a sheer cliff at the edge of the sea. It has trouble keeping its wings flapping in flight. Instead, it soars on updrafts."
279,pelipper,water,"It skims the tops of waves as it flies. When it spots prey, it uses its large beak to scoop up the victim with water. It protects its eggs in its beak."
280,ralts,psychic,A RALTS has the power to sense the emotions of people and POKéMON with the horns on its head. It takes cover if it senses any hostility.
281,kirlia,psychic,A KIRLIA has the psychic power to create a rip in the dimensions and see into the future. It is said to dance with pleasure on sunny mornings.
282,gardevoir,psychic,It apparently does not feel the pull of gravity because it supports itself with psychic power. It will give its life to protect its TRAINER.
283,surskit,bug,"They gather on puddles after evening downpours, gliding across the surface of water as if sliding. It secretes honey with a sweet aroma from its head."
284,masquerain,bug,"It intimidates foes with the large eyelike patterns on its antennae. Because it can’t fly if its wings get wet, it shelters itself from rain under large trees and eaves."
285,shroomish,grass,"It loves to eat damp, composted soil in forests. If you enter a forest after a long rain, you can see many SHROOMISH feasting on composted soil."
286,breloom,grass,It scatters spores from holes in the cap on its head. It loves warm and humid climates. It feeds on trees and plants in fields and forests.
287,slakoth,normal,"It sleeps virtually all day and night long. It doesn’t change its nest its entire life, but it sometimes travels great distances by swimming in rivers."
288,vigoroth,normal,"It can’t keep still because its blood boils with energy. It runs through the fields and mountains all day to calm itself. If it doesn’t, it can’t sleep at night."
289,slaking,normal,Hordes of SLAKING gather around trees when fruits come into season. They wait around patiently for ripened fruits to fall out of the trees.
290,nincada,bug,"It makes its nest at the roots of a mighty tree. Using its whiskerlike antennae, it probes its surroundings in the pitch-black darkness of soil."
291,ninjask,bug,"Because it darts about vigorously at high speed, it is very difficult to see. Hearing its distinctive cries for too long induces a headache."
292,shedinja,bug,A peculiar POKéMON that floats in air even though its wings remain completely still. The inside of its body is hollow and utterly dark.
293,whismur,normal,"Its cries equal a jet plane in volume. It inhales through its ear canals. Because of this system, it can cry continually without having to catch its breath."
294,loudred,normal,It positions the round speakers on its head to assail foes with ultrasonic waves at massive volume. It builds power by stomping the ground.
295,exploud,normal,It has sound-generating organs all over its body. It communicates with others by adjusting the tone and volume of the cries it emits.
296,makuhita,fighting,"It loves to toughen up its body above all else. If you hear quaking rumbles in a cave, it is the sound of MAKUHITA undertaking strenuous training."
297,hariyama,fighting,It has the habit of challenging others without hesitation to tests of strength. It’s been known to stand on train tracks and stop trains using forearm thrusts.
298,azurill,normal,"Its tail, which is packed with nutrition, is very bouncy like a rubber ball. On sunny days they gather at the edge of water and splash about for fun."
299,nosepass,rock,Its body emits a powerful magnetism. It feeds on prey that is pulled in by the force. Its magnetism is stronger in cold seasons.
300,skitty,normal,"A SKITTY’s adorably cute behavior makes it highly popular. In battle, it makes its tail puff out. It threatens foes with a sharp growl."
301,delcatty,normal,"Rather than keeping a permanent lair, it habitually seeks comfortable spots and sleeps there. It is nocturnal and becomes active at dusk."
