id,name,type,entry
302,sableye,dark,It digs branching holes in caves using its sharp claws in search of food--raw gems. A SABLEYE lurks in darkness and is seen only rarely.
303,mawile,steel,"Its giant jaws are actually steel horns that transformed. It fools foes into complacency with its adorable gestures, then chomps them with its huge jaws."
304,aron,steel,"A POKéMON that is clad in steel armor. A new suit of armor is made when it evolves. The old, discarded armor is salvaged as metal for making iron products."
305,lairon,steel,"When two LAIRON meet in the wild, they fight for territory by bashing into each other with their steel bodies. The sound of their collision carries for miles."
306,aggron,steel,Its iron horns grow longer a little at a time. They are used to determine the AGGRON’s age. The gouges in its armor are worn with pride as mementos from battles.
307,meditite,fighting,"It continually meditates for hours every day. As a result of rigorous and dedicated yoga training, it has tempered its spiritual power so much it can fly."
308,medicham,fighting,"Through crushingly harsh yoga training, it gained the power to foretell its foe’s actions. It battles with elegant, dance- like movement."
309,electrike,electric,"It generates electricity using friction from the atmosphere. In seasons with especially arid air, its entire body blazes with violent showers of sparks."
310,manectric,electric,"Because lightning falls in their vicinities, MANECTRIC were thought to have been born from lightning. In battle, they create thunderclouds."
311,plusle,electric,"It has the trait of cheering on its fellow POKéMON. By shorting out the electricity it releases from its paws, it creates pom-poms for cheering."
312,minun,electric,"At a meeting of POKéMON academics, it was announced that simultaneous exposure to electricity from a PLUSLE and MINUN will promote circulation and boost vitality."
313,volbeat,bug,"With their taillights lit, VOLBEAT fly in a swarm, drawing geometric designs in the night sky. They move their nests if their pond water becomes dirty."
314,illumise,bug,A nocturnal POKéMON that becomes active upon nightfall. It leads a VOLBEAT swarm to draw patterns in the night sky. Over 200 different patterns have been confirmed.
315,roselia,grass,A ROSELIA that drinks nutritionally rich springwater blooms with lovely flowers. The fragrance of its flowers has the effect of making its foes careless.
316,gulpin,poison,"This POKéMON’s stomach fluid can even digest scrap iron. In one gulp, it can swallow something that is as large as itself."
317,swalot,poison,Its powerful stomach acid is capable of digesting almost anything. The one thing in the whole world a SWALOT can’t digest is its own stomach.
318,carvanha,water,"CARVANHA attack ships in swarms, making them sink. Although it is said to be a very vicious POKéMON, it timidly flees as soon as it finds itself alone."
319,sharpedo,water,The vicious and sly gangster of the sea. Its skin is specially textured to minimize drag in water. Its speed tops out at over 75 miles per hour.
320,wailmer,water,"While this POKéMON usually lives in the sea, it can survive on land, although not too long. It loses vitality if its body becomes dried out."
321,wailord,water,"It breathes through nostrils that it raises above the sea. By inhaling to its maximum capacity, a WAILORD can dive close to 10,000 feet beneath the waves."
322,numel,fire,A NUMEL stores boiling magma in the hump on its back. It is a hardy POKéMON that can transport a 220-pound load. It has served humans at work since long ago.
323,camerupt,fire,"A POKéMON that lives in the crater of a volcano. Every 10 years, the volcanoes on its back erupt violently. Research is under way on the cause of eruption."
324,torkoal,fire,"It battles using energy it gets from burning coal. When loosing smoke from its nostrils, it lets off a sound that is similar to a locomotive’s horn."
325,spoink,psychic,A POKéMON that manipulates psychic power at will. It doesn’t stop bouncing even when it is asleep. It loves eating mushrooms that grow underground.
326,grumpig,psychic,"It stores power in the black pearls on its forehead. When it uses psychic power, it performs an odd dance step. Its style of dancing became hugely popular overseas."
327,spinda,normal,"It is distinguished by a pattern of spots that is always different. Its unsteady, tottering walk has the effect of fouling its foe’s aim."
328,trapinch,ground,"Its big jaws crunch through boulders. Because its head is so big, it has a hard time getting back upright if it tips over onto its back."
329,vibrava,ground,"It looses ultrasonic waves by rubbing its wings together. Since a VIBRAVA’s wings are still in the process of growing, it can only fly short distances."
330,flygon,ground,"The flapping of its wings sounds like singing. To prevent detection by enemies, it hides itself by flapping up a cloud of desert sand."
331,cacnea,grass,"CACNEA live in deserts with virtually no rainfall. It battles by swinging its thick, spiked arms. Once a year, a yellow flower blooms."
332,cacturne,grass,"After spending thousands of years in harsh deserts, its blood transformed into the same substances as sand. It is nocturnal, so it hunts at night."
333,swablu,normal,"A POKéMON that has wings like cottony clouds. After enduring winter, in which little food is available, SWABLU flocks move closer to towns in the spring."
334,altaria,dragon,It hums in a beautiful soprano voice. It flies among white clouds in the blue sky. It launches intensely hot fireballs from its mouth.
335,zangoose,normal,"When it battles, it stands on its hind legs and attacks with its sharply clawed forelegs. Its fur bristles if it encounters any SEVIPER."
336,seviper,poison,"SEVIPER and ZANGOOSE are eternal rivals. It counters a ZANGOOSE’s dazzling agility with its swordlike tail, which also oozes a horrible poison."
337,lunatone,rock,It becomes very active on the night of a full moon. This POKéMON was first discovered 40 years ago at the site of a meteor strike.
338,solrock,rock,"Solar energy is the source of this POKéMON’s power. On sunny days, groups of SOLROCK line up facing the sun and absorb its light."
339,barboach,water,Its body is covered with a slimy film. The film acts as a barrier to prevent germs in muddy water from entering the BARBOACH’s body.
340,whiscash,water,"Mysteriously, it can foretell earthquakes. In the daytime, it sleeps in mud at the bottom of a pond. When it awakens, it continually feeds throughout the night."
341,corphish,water,"Once it grips prey with its large pincers, it will never let go, no matter what. It is a hardy POKéMON that can thrive in any environment."
342,crawdaunt,water,A brutish POKéMON that loves to battle. A veteran CRAWDAUNT that has prevailed in hundreds of battles has giant pincers marked with countless scars.
343,baltoy,ground,A BALTOY moves by spinning on its single foot. It has been depicted in murals adorning the walls of a once-bustling city in an ancient age.
344,claydol,ground,A CLAYDOL sleeps while hovering in midair. Its arms are separate from its body. They are kept floating by the POKéMON’s manipulation of psychic power.
345,lileep,rock,It disguises itself as seaweed by making its tentacles sway. Unsuspecting prey that come too close are swallowed whole. It became extinct 100 million years ago.
346,cradily,rock,It drags its heavy body along the seafloor. It makes its nest in the shallows of warm seas. CRADILY can be seen on beaches when the tide goes out.
347,anorith,rock,It was resurrected from a fossil using the power of science. It swims by undulating the eight wings at its sides. They were feet that adapted to life in the sea.
348,armaldo,rock,"ARMALDO usually lives on land. However, when it hunts for prey, it dives beneath the ocean. It swims around using its two large wings."
349,feebas,water,"FEEBAS live in ponds that are heavily infested with weeds. Because of its hopelessly shabby appearance, it seems as if few TRAINERS raise it."
350,milotic,water,"It is said to live at the bottom of large lakes. Considered to be the most beautiful of all POKéMON, it has been depicted in paintings and statues."
351,castform,normal,It alters its form depending on the weather. Changes in the climate such as the temperature and humidity appear to affect its cellular structure.
352,kecleon,normal,A POKéMON that has the ability to alter its body colors to match its surroundings. A KECLEON reverts to its original colors if it is startled.
353,shuppet,ghost,This POKéMON roams about deep in the night seeking such negative emotions as grudges and envy. It retreats to its nest when the sun begins to rise.
354,banette,ghost,An abandoned plush doll became this POKéMON. They are said to live in garbage dumps and wander about in search of the children that threw them away.
355,duskull,ghost,A glare from its single scarlet eye makes even burly grown-ups freeze in utter fear. It is a nocturnal POKéMON that roams about under the cloak of darkness.
356,dusclops,ghost,"It is thought that its body is hollow with only a spectral ball of fire burning inside. However, no one has been able to confirm this theory as fact."
357,tropius,grass,"It flies by flapping its broad leaves. The bunch of fruit that grows around its neck is deliciously sweet. In the spring, it scatters pollen from its neck."
358,chimecho,psychic,They fly about very actively when the hot season arrives. They communicate among themselves using seven different and distinguishing cries.
359,absol,dark,It sharply senses even subtle changes in the sky and the land to predict natural disasters. It is a long-lived POKéMON that has a life-span of 100 years.
360,wynaut,psychic,"A WYNAUT loves to eat sweet fruits. It cleverly picks fruits using its earlike arms. They gather in fruit gardens, drawn by the fragrance."
361,snorunt,ice,"They tend to move about in groups of around five SNORUNT. In snowy regions, it is said that when they are seen late at night, snowfall will arrive by morning."
362,glalie,ice,A GLALIE has the power to instantaneously freeze moisture in the atmosphere. A dazzling cloud of diamondlike ice crystals forms around its body.
363,spheal,ice,"It is completely covered with plushy fur. As a result, it never feels the cold even when it is rolling about on ice floes or diving in the sea."
364,sealeo,ice,"SEALEO live in herds on ice floes. Using its powerful flippers, it shatters ice. It dives into the sea to hunt prey five times a day."
365,walrein,ice,"To protect its herd, the leader battles anything that invades its territory, even at the cost of its life. Its tusks may snap off in battle."
366,clamperl,water,A CLAMPERL slams its shell closed on prey to prevent escape. The pearl it creates upon evolution is said to be infused with a mysterious energy.
367,huntail,water,"To withstand the crushing pressure of water deep under the sea, its spine is very thick and sturdy. Its tail, which is shaped like a small fish, has eyes that light up."
368,gorebyss,water,"A GOREBYSS siphons the body fluids of prey through its thin, tubular mouth. Its light pink body color turns vivid when it finishes feeding."
369,relicanth,water,A POKéMON that was once believed to have been extinct. The species has not changed its form for 100 million years. It walks on the seafloor using its pectoral fins.
370,luvdisc,water,LUVDISC make the branches of CORSOLA their nests. There is a custom from long ago of giving a LUVDISC as a gift to express one’s feelings of love.
371,bagon,dragon,"Although it is small, this POKéMON is very powerful because its body is a bundle of muscles. It launches head-butts with its ironlike skull."
372,shelgon,dragon,It hardly eats while it awaits evolution. It becomes hardier by enduring hunger. Its shell peels off the instant it begins to evolve.
373,salamence,dragon,"After many long years, its cellular structure underwent a sudden mutation to grow wings. When angered, it loses all thought and rampages out of control."
374,beldum,steel,"When BELDUM gather in a swarm, they move in perfect unison as if they were but one POKéMON. They communicate with each other using brain waves."
375,metang,steel,The claws tipping its arms pack the destructive power to tear through thick iron sheets as if they were silk. It flies at over 60 miles per hour.
376,metagross,steel,"METAGROSS has four brains that are joined by a complex neural network. As a result of integration, this POKéMON is smarter than a supercomputer."
377,regirock,rock,"A POKéMON that is made entirely of rocks and boulders. If parts of its body chip off in battle, REGIROCK repairs itself by adding new rocks."
378,regice,ice,"Its entire body is made of Antarctic ice. After extensive studies, researchers believe the ice was formed during an ice age."
379,registeel,steel,"Its body is harder than any other kind of metal. The body metal is composed of a mysterious substance. Not only is it hard, it shrinks and stretches flexibly."
380,latias,dragon,They make a small herd of only several members. They rarely make contact with people or other POKéMON. They disappear if they sense enemies.
381,latios,dragon,"Even in hiding, it can detect the locations of others and sense their emotions since it has telepathy. Its intelligence allows it to understand human languages."
382,kyogre,water,"KYOGRE has appeared in mythology as the creator of the sea. After long years of feuding with GROUDON, it took to sleep at the bottom of the sea."
383,groudon,ground,GROUDON has appeared in mythology as the creator of the land. It sleeps in magma underground and is said to make volcanoes erupt on awakening.
384,rayquaza,dragon,A POKéMON that flies endlessly in the ozone layer. It is said it would descend to the ground if KYOGRE and GROUDON were to fight.
385,jirachi,steel,"JIRACHI is said to make wishes come true. While it sleeps, a tough crystalline shell envelops the body to protect it from enemies."
386,deoxys-normal,psychic,A POKéMON that mutated from an extraterrestrial virus exposed to a laser beam. Its body is configured for superior agility and speed.
